{
  "title": "TICKET MACHINE GUIDE",
  "steps": [
    "Insert money",
    "Select your item",
    "Take your ticket",
    "Give ticket to staff"
  ],
  "rows": [
    {
      "category": "ramen_row_1",
      "buttons": [
        "Shoyu Ramen",
        "Miso Ramen",
        "Spicy Tonkotsu",
        "Vegetarian Ramen"
      ]
    },
    {
      "category": "ramen_row_2",
      "buttons": [
        "Chicken Paitan",
        "Shio Ramen",
        "Tantanmen",
        "Black Garlic Ramen"
      ]
    },
    {
      "category": "sides_row",
      "buttons": [
        "Gyoza",
        "Edamame",
        "Karaage",
        "Takoyaki"
      ]
    },
    {
      "category": "toppings_row",
      "buttons": [
        "Extra Noodles",
        "Soft-Boiled Egg",
        "Nori",
        "Chashu Pork"
      ]
    }
  ],
  "footer_note": null
}